{
  "opendb_id": "1e1b5cba-d256-4bbb-b600-2eb6e5a3d1fe",
  "memory": {
    "max": 128,
    "ram_type": "DDR4",
    "slots": 4
  },
  "storage_devices": {
    "sata_6_gb_s": 6,
    "sata_3_gb_s": 0,
    "u2": 0
  },
  "usb_headers": {
    "usb_2_0": 2,
    "usb_3_2_gen_1": 1,
    "usb_3_2_gen_2": 1,
    "usb_3_2_gen_2x2": 0,
    "usb_4": 0
  },
  "power_connectors": {
    "cpu_power": []
  },
  "audio": {
    "chipset": "Realtek",
    "channels": "7.1"
  },
  "metadata": {
    "name": "Gigabyte Z590 Z590M GAMING X DDR4 Micro ATX",
    "manufacturer": "Gigabyte",
    "part_numbers": [
      "Z590M GAMING X"
    ],
    "series": "Z590",
    "variant": ""
  },
  "socket": "LGA1200",
  "form_factor": "Micro ATX",
  "chipset": "Intel Z590",
  "color": [
    "BLACK",
    "GREY"
  ],
  "pcie_slots": [
    {
      "gen": "4.0",
      "quantity": 2,
      "lanes": 16,
      "_id": "67f9b8e2865ad0c3553dd038"
    },
    {
      "gen": "4.0",
      "quantity": 1,
      "lanes": 1,
      "_id": "67f9b8e2865ad0c3553dd039"
    }
  ],
  "m2_slots": [
    {
      "size": "2260-2280",
      "key": "M",
      "interface": "PCIe 4.0 x4",
      "_id": "67f9b8e2865ad0c3553dd03a"
    },
    {
      "size": "2280",
      "key": "M",
      "interface": "PCIe 4.0 x4",
      "_id": "67f9b8e2865ad0c3553dd03b"
    },
    {
      "size": "2260-2280",
      "key": "M",
      "interface": "PCIe 4.0 x4",
      "_id": "67f9b8e2865ad0c3553dd03c"
    },
    {
      "size": "2280",
      "key": "M",
      "interface": "PCIe 4.0 x4",
      "_id": "67f9b8e2865ad0c3553dd03d"
    }
  ],
  "onboard_ethernet": [
    {
      "speed": "2.5 Gb/s",
      "controller": "Realtek",
      "_id": "67f9b8e2865ad0c3553dd03e"
    }
  ],
  "ecc_support": false,
  "raid_support": true,
  "back_connect_connectors": false,
  "bios_features": {
    "flashback": false,
    "clear_cmos": false,
    "_id": "67f9b8e2865ad0c3553dd03f"
  },
  "back_panel_ports": [
    "1 x 2.5 Gb/s (Realtek)"
  ],
  "general_product_information": {}
}