{
  "opendb_id": "f8564582-11b3-4597-aa9d-0d220eb4cf99",
  "memory": {
    "max": 64,
    "ram_type": "DDR3",
    "slots": 4
  },
  "storage_devices": {
    "sata_6_gb_s": 8,
    "sata_3_gb_s": 0,
    "u2": 0
  },
  "usb_headers": {
    "usb_2_0": 2,
    "usb_3_2_gen_1": 1,
    "usb_3_2_gen_2": 0,
    "usb_3_2_gen_2x2": 0,
    "usb_4": 0
  },
  "power_connectors": {
    "cpu_power": []
  },
  "audio": {
    "chipset": "Realtek",
    "channels": "7.1"
  },
  "metadata": {
    "name": "Gigabyte A88X GA-F2A88X-D3H FM2+ DDR3 ATX",
    "manufacturer": "Gigabyte",
    "part_numbers": [
      "GA-F2A88X-D3H"
    ],
    "series": "A88X",
    "variant": ""
  },
  "socket": "FM2+",
  "form_factor": "ATX",
  "chipset": "AMD A88X",
  "color": [
    "BLACK",
    "GREY"
  ],
  "pcie_slots": [
    {
      "gen": "4.0",
      "quantity": 2,
      "lanes": 16,
      "_id": "67f9b6b7865ad0c3553d9333"
    },
    {
      "gen": "4.0",
      "quantity": 3,
      "lanes": 1,
      "_id": "67f9b6b7865ad0c3553d9334"
    }
  ],
  "m2_slots": [],
  "onboard_ethernet": [
    {
      "speed": "1 Gb/s",
      "controller": "Unknown",
      "_id": "67f9b6b7865ad0c3553d9335"
    }
  ],
  "ecc_support": false,
  "raid_support": true,
  "back_connect_connectors": false,
  "bios_features": {
    "flashback": false,
    "clear_cmos": false,
    "_id": "67f9b6b7865ad0c3553d9336"
  },
  "back_panel_ports": [
    "1 x 1 Gb/s"
  ],
  "general_product_information": {}
}