{
  "opendb_id": "f278d2eb-8269-415e-9f7d-917ea68b24ec",
  "memory": {
    "max": 192,
    "ram_type": "DDR5",
    "slots": 4
  },
  "storage_devices": {
    "sata_6_gb_s": 6,
    "sata_3_gb_s": 0,
    "u2": 0
  },
  "usb_headers": {
    "usb_2_0": 2,
    "usb_3_2_gen_1": 2,
    "usb_3_2_gen_2": 1,
    "usb_3_2_gen_2x2": 0,
    "usb_4": 0
  },
  "power_connectors": {
    "cpu_power": []
  },
  "audio": {
    "chipset": "Realtek",
    "channels": "7.1"
  },
  "metadata": {
    "name": "Asus X670 PRIME X670-P WIFI-CSM AM5 DDR5 ATX",
    "manufacturer": "ASUS",
    "part_numbers": [
      "PRIME X670-P WIFI-CSM"
    ],
    "series": "X670",
    "variant": ""
  },
  "socket": "AM5",
  "form_factor": "ATX",
  "chipset": "AMD X670",
  "color": [
    "GREY",
    "BLACK"
  ],
  "pcie_slots": [
    {
      "gen": "4.0",
      "quantity": 3,
      "lanes": 16,
      "_id": "67f9b6d5865ad0c3553d9642"
    },
    {
      "gen": "4.0",
      "quantity": 1,
      "lanes": 1,
      "_id": "67f9b6d5865ad0c3553d9643"
    }
  ],
  "m2_slots": [
    {
      "size": "2242-2260",
      "key": "M",
      "interface": "PCIe 4.0 x4",
      "_id": "67f9b6d5865ad0c3553d9644"
    },
    {
      "size": "2280",
      "key": "M",
      "interface": "PCIe 4.0 x4",
      "_id": "67f9b6d5865ad0c3553d9645"
    },
    {
      "size": "2242-2260",
      "key": "M",
      "interface": "PCIe 4.0 x4",
      "_id": "67f9b6d5865ad0c3553d9646"
    },
    {
      "size": "2280",
      "key": "M",
      "interface": "PCIe 4.0 x4",
      "_id": "67f9b6d5865ad0c3553d9647"
    },
    {
      "size": "2242-2260",
      "key": "M",
      "interface": "PCIe 4.0 x4",
      "_id": "67f9b6d5865ad0c3553d9648"
    },
    {
      "size": "2280",
      "key": "M",
      "interface": "PCIe 4.0 x4",
      "_id": "67f9b6d5865ad0c3553d9649"
    }
  ],
  "onboard_ethernet": [
    {
      "speed": "2.5 Gb/s",
      "controller": "Realtek",
      "_id": "67f9b6d5865ad0c3553d964a"
    }
  ],
  "ecc_support": false,
  "raid_support": true,
  "back_connect_connectors": false,
  "bios_features": {
    "flashback": false,
    "clear_cmos": false,
    "_id": "67f9b6d5865ad0c3553d964b"
  },
  "back_panel_ports": [
    "1 x 2.5 Gb/s (Realtek)"
  ],
  "general_product_information": {}
}