{
  "opendb_id": "672e11ed-afb5-4895-ba6a-841ed0e5f429",
  "memory": {
    "max": 32,
    "ram_type": "DDR3",
    "slots": 2
  },
  "storage_devices": {
    "sata_6_gb_s": 6,
    "sata_3_gb_s": 0,
    "u2": 0
  },
  "usb_headers": {
    "usb_2_0": 2,
    "usb_3_2_gen_1": 1,
    "usb_3_2_gen_2": 0,
    "usb_3_2_gen_2x2": 0,
    "usb_4": 0
  },
  "power_connectors": {
    "cpu_power": []
  },
  "audio": {
    "chipset": "Realtek",
    "channels": "7.1"
  },
  "metadata": {
    "name": "ASRock A88X FM2A88X-ITX+ FM2+ DDR3 Mini ITX",
    "manufacturer": "ASRock",
    "part_numbers": [
      "FM2A88X-ITX+"
    ],
    "series": "A88X",
    "variant": ""
  },
  "socket": "FM2+",
  "form_factor": "Mini-ITX",
  "chipset": "AMD A88X",
  "color": [
    "BLACK",
    "GREY"
  ],
  "pcie_slots": [
    {
      "gen": "4.0",
      "quantity": 1,
      "lanes": 16,
      "_id": "67f9b6c8865ad0c3553d94e8"
    }
  ],
  "m2_slots": [],
  "onboard_ethernet": [
    {
      "speed": "1 Gb/s",
      "controller": "Unknown",
      "_id": "67f9b6c8865ad0c3553d94e9"
    }
  ],
  "ecc_support": false,
  "raid_support": true,
  "back_connect_connectors": false,
  "bios_features": {
    "flashback": false,
    "clear_cmos": false,
    "_id": "67f9b6c8865ad0c3553d94ea"
  },
  "back_panel_ports": [
    "1 x 1 Gb/s"
  ],
  "general_product_information": {}
}