{
  "opendb_id": "9fe02aec-5837-4b53-9f7e-ca382780dc98",
  "memory": {
    "max": 128,
    "ram_type": "DDR5",
    "slots": 4
  },
  "storage_devices": {
    "sata_6_gb_s": 0,
    "sata_3_gb_s": 0,
    "u2": 0
  },
  "usb_headers": {
    "usb_2_0": 3,
    "usb_3_2_gen_1": 2,
    "usb_3_2_gen_2": 1,
    "usb_3_2_gen_2x2": 0,
    "usb_4": 0
  },
  "power_connectors": {
    "cpu_power": []
  },
  "audio": {
    "chipset": "Realtek",
    "channels": "7.1"
  },
  "metadata": {
    "name": "NZXT B650E N7 AM5 DDR5 ATX",
    "manufacturer": "NZXT",
    "part_numbers": [
      "N7-B65XT-W1"
    ],
    "series": "B650E",
    "variant": ""
  },
  "socket": "AM5",
  "form_factor": "ATX",
  "chipset": "AMD B650E",
  "color": [
    "WHITE"
  ],
  "pcie_slots": [
    {
      "gen": "4.0",
      "quantity": 3,
      "lanes": 16,
      "_id": "67f9ba4a865ad0c3553df7c5"
    }
  ],
  "m2_slots": [
    {
      "size": "2242-2260",
      "key": "M",
      "interface": "PCIe 4.0 x4",
      "_id": "67f9ba4a865ad0c3553df7c6"
    },
    {
      "size": "2280",
      "key": "M",
      "interface": "PCIe 4.0 x4",
      "_id": "67f9ba4a865ad0c3553df7c7"
    },
    {
      "size": "2242-2260",
      "key": "M",
      "interface": "PCIe 4.0 x4",
      "_id": "67f9ba4a865ad0c3553df7c8"
    },
    {
      "size": "2280",
      "key": "M",
      "interface": "PCIe 4.0 x4",
      "_id": "67f9ba4a865ad0c3553df7c9"
    },
    {
      "size": "2242-2260",
      "key": "M",
      "interface": "PCIe 4.0 x4",
      "_id": "67f9ba4a865ad0c3553df7ca"
    },
    {
      "size": "2280",
      "key": "M",
      "interface": "PCIe 4.0 x4",
      "_id": "67f9ba4a865ad0c3553df7cb"
    },
    {
      "size": "2280",
      "key": "E",
      "interface": "PCIe 4.0 x4",
      "_id": "67f9ba4a865ad0c3553df7cc"
    }
  ],
  "onboard_ethernet": [
    {
      "speed": "2.5 Gb/s",
      "controller": "Realtek RTL8125BG",
      "_id": "67f9ba4a865ad0c3553df7cd"
    }
  ],
  "ecc_support": false,
  "raid_support": true,
  "back_connect_connectors": false,
  "bios_features": {
    "flashback": false,
    "clear_cmos": false,
    "_id": "67f9ba4a865ad0c3553df7ce"
  },
  "back_panel_ports": [
    "1 x 2.5 Gb/s Ports (Realtek RTL8125BG)"
  ],
  "general_product_information": {
    "amazon_sku": "B0BFZYB6QW",
    "newegg_sku": "2MG-007A-00005",
    "bestbuy_sku": 6538043,
    "walmart_sku": 2101716910
  }
}