{
  "opendb_id": "9013ec36-714c-48b5-9a9d-b45b50a3e013",
  "memory": {
    "max": 192,
    "ram_type": "DDR5",
    "slots": 4
  },
  "storage_devices": {
    "sata_6_gb_s": 0,
    "sata_3_gb_s": 0,
    "u2": 0
  },
  "usb_headers": {
    "usb_2_0": 2,
    "usb_3_2_gen_1": 1,
    "usb_3_2_gen_2": 0,
    "usb_3_2_gen_2x2": 1,
    "usb_4": 0
  },
  "power_connectors": {
    "cpu_power": []
  },
  "audio": {
    "chipset": "Realtek",
    "channels": "7.1"
  },
  "metadata": {
    "name": "NZXT Z790 N7 Z790 LGA1700 DDR5 ATX",
    "manufacturer": "NZXT",
    "part_numbers": [
      "N7-Z79XT-B1"
    ],
    "series": "Z790",
    "variant": ""
  },
  "socket": "LGA1700",
  "form_factor": "ATX",
  "chipset": "Intel Z790",
  "color": [
    "BLACK"
  ],
  "pcie_slots": [
    {
      "gen": "4.0",
      "quantity": 3,
      "lanes": 16,
      "_id": "67f9b8b5865ad0c3553dcb2f"
    },
    {
      "gen": "4.0",
      "quantity": 2,
      "lanes": 1,
      "_id": "67f9b8b5865ad0c3553dcb30"
    }
  ],
  "m2_slots": [
    {
      "size": "2242-2260",
      "key": "M",
      "interface": "PCIe 4.0 x4",
      "_id": "67f9b8b5865ad0c3553dcb31"
    },
    {
      "size": "2280",
      "key": "M",
      "interface": "PCIe 4.0 x4",
      "_id": "67f9b8b5865ad0c3553dcb32"
    },
    {
      "size": "2242-2260",
      "key": "M",
      "interface": "PCIe 4.0 x4",
      "_id": "67f9b8b5865ad0c3553dcb33"
    },
    {
      "size": "2280",
      "key": "M",
      "interface": "PCIe 4.0 x4",
      "_id": "67f9b8b5865ad0c3553dcb34"
    },
    {
      "size": "2242-2260",
      "key": "M",
      "interface": "PCIe 4.0 x4",
      "_id": "67f9b8b5865ad0c3553dcb35"
    },
    {
      "size": "2280",
      "key": "M",
      "interface": "PCIe 4.0 x4",
      "_id": "67f9b8b5865ad0c3553dcb36"
    },
    {
      "size": "2280",
      "key": "E",
      "interface": "PCIe 4.0 x4",
      "_id": "67f9b8b5865ad0c3553dcb37"
    }
  ],
  "onboard_ethernet": [
    {
      "speed": "2.5 Gb/s",
      "controller": "Realtek RTL8125BG",
      "_id": "67f9b8b5865ad0c3553dcb38"
    }
  ],
  "ecc_support": false,
  "raid_support": true,
  "back_connect_connectors": false,
  "bios_features": {
    "flashback": false,
    "clear_cmos": false,
    "_id": "67f9b8b5865ad0c3553dcb39"
  },
  "back_panel_ports": [
    "1 x 2.5 Gb/s Ports (Realtek RTL8125BG)"
  ],
  "general_product_information": {
    "amazon_sku": "B0BG18N3FX",
    "newegg_sku": "N82E16813206007",
    "bestbuy_sku": 6538046,
    "walmart_sku": 2214476898
  }
}