{
  "opendb_id": "6a1e7710-d7ca-4c57-bf56-9b32810aca86",
  "memory": {
    "max": 128,
    "ram_type": "DDR4",
    "slots": 4
  },
  "storage_devices": {
    "sata_6_gb_s": 0,
    "sata_3_gb_s": 0,
    "u2": 0
  },
  "usb_headers": {
    "usb_2_0": 2,
    "usb_3_2_gen_1": 1,
    "usb_3_2_gen_2": 1,
    "usb_3_2_gen_2x2": 0,
    "usb_4": 0
  },
  "power_connectors": {
    "cpu_power": []
  },
  "audio": {
    "chipset": "Realtek",
    "channels": "7.1"
  },
  "metadata": {
    "name": "Gigabyte B760M D3HP LGA1700 DDR4 Micro ATX",
    "manufacturer": "Gigabyte",
    "part_numbers": [
      "B760M D3HP DDR4"
    ],
    "series": "B760M",
    "variant": ""
  },
  "socket": "LGA1700",
  "form_factor": "Micro ATX",
  "chipset": "Intel B760",
  "color": [
    "BLACK",
    "GREY"
  ],
  "pcie_slots": [
    {
      "gen": "4.0",
      "quantity": 1,
      "lanes": 16,
      "_id": "67f9b7de865ad0c3553db2a0"
    },
    {
      "gen": "4.0",
      "quantity": 2,
      "lanes": 1,
      "_id": "67f9b7de865ad0c3553db2a1"
    }
  ],
  "m2_slots": [
    {
      "size": "2280",
      "key": "M",
      "interface": "PCIe 4.0 x4",
      "_id": "67f9b7de865ad0c3553db2a2"
    },
    {
      "size": "2280",
      "key": "M",
      "interface": "PCIe 4.0 x4",
      "_id": "67f9b7de865ad0c3553db2a3"
    }
  ],
  "onboard_ethernet": [
    {
      "speed": "1 Gb/s",
      "controller": "Realtek",
      "_id": "67f9b7de865ad0c3553db2a4"
    }
  ],
  "ecc_support": false,
  "raid_support": false,
  "back_connect_connectors": false,
  "bios_features": {
    "flashback": false,
    "clear_cmos": false,
    "_id": "67f9b7de865ad0c3553db2a5"
  },
  "back_panel_ports": [
    "1 x 1 Gb/s Ports (Realtek)"
  ],
  "general_product_information": {}
}