{
  "opendb_id": "5795af2d-6f00-4697-8358-ad64b172a8f2",
  "memory": {
    "max": 64,
    "ram_type": "DDR4",
    "slots": 4
  },
  "storage_devices": {
    "sata_6_gb_s": 0,
    "sata_3_gb_s": 0,
    "u2": 0
  },
  "usb_headers": {
    "usb_2_0": 2,
    "usb_3_2_gen_1": 1,
    "usb_3_2_gen_2": 0,
    "usb_3_2_gen_2x2": 0,
    "usb_4": 0
  },
  "power_connectors": {
    "cpu_power": []
  },
  "audio": {
    "chipset": "Realtek",
    "channels": "7.1"
  },
  "metadata": {
    "name": "Gigabyte B360M D3H GSM DDR4 Micro ATX",
    "manufacturer": "Gigabyte",
    "part_numbers": [
      "B360M D3H GSM"
    ],
    "series": "B360M",
    "variant": ""
  },
  "socket": "LGA1151",
  "form_factor": "Micro ATX",
  "chipset": "Intel B360",
  "color": [
    "BLACK"
  ],
  "pcie_slots": [
    {
      "gen": "4.0",
      "quantity": 2,
      "lanes": 16,
      "_id": "68cb89cf9b67bc35527b4572"
    },
    {
      "gen": "4.0",
      "quantity": 1,
      "lanes": 1,
      "_id": "68cb89cf9b67bc35527b4573"
    }
  ],
  "m2_slots": [
    {
      "size": "2242-2260",
      "key": "M",
      "interface": "PCIe 4.0 x4",
      "_id": "68cb89cf9b67bc35527b4574"
    },
    {
      "size": "2280",
      "key": "M",
      "interface": "PCIe 4.0 x4",
      "_id": "68cb89cf9b67bc35527b4575"
    }
  ],
  "onboard_ethernet": [
    {
      "speed": "1 Gb/s",
      "controller": "Unknown",
      "_id": "68cb89cf9b67bc35527b4576"
    }
  ],
  "ecc_support": false,
  "raid_support": false,
  "back_connect_connectors": false,
  "bios_features": {
    "flashback": false,
    "clear_cmos": false,
    "_id": "68cb89cf9b67bc35527b4577"
  },
  "back_panel_ports": [
    "1 x 1 Gb/s Ports"
  ],
  "general_product_information": {
    "amazon_sku": "B07DJBR5M6",
    "walmart_sku": 379427578
  }
}