{
  "opendb_id": "5f4c5834-24f9-490c-bc2e-bb16cf417c9c",
  "memory": {
    "max": 256,
    "ram_type": "DDR5",
    "slots": 4
  },
  "storage_devices": {
    "sata_6_gb_s": 0,
    "sata_3_gb_s": 0,
    "u2": 0
  },
  "usb_headers": {
    "usb_2_0": 2,
    "usb_3_2_gen_1": 1,
    "usb_3_2_gen_2": 1,
    "usb_3_2_gen_2x2": 0,
    "usb_4": 0
  },
  "power_connectors": {
    "cpu_power": []
  },
  "audio": {
    "chipset": "Realtek",
    "channels": "7.1"
  },
  "metadata": {
    "name": "ASUS ROG STRIX B850-E GAMING WIFI DDR5 ATX",
    "manufacturer": "ASUS",
    "part_numbers": [
      "ROG STRIX B850-E GAMING WIFI                                                    90MB1J60-M0EAY0"
    ],
    "series": "ASUS",
    "variant": ""
  },
  "socket": "AM5",
  "form_factor": "ATX",
  "chipset": "AMD B850",
  "color": [
    "BLACK"
  ],
  "pcie_slots": [
    {
      "gen": "4.0",
      "quantity": 2,
      "lanes": 16,
      "_id": "67f9b7ce865ad0c3553db12a"
    }
  ],
  "m2_slots": [
    {
      "size": "2242-2260",
      "key": "M",
      "interface": "PCIe 4.0 x4",
      "_id": "67f9b7ce865ad0c3553db12b"
    },
    {
      "size": "2280",
      "key": "M",
      "interface": "PCIe 4.0 x4",
      "_id": "67f9b7ce865ad0c3553db12c"
    },
    {
      "size": "2242-2260",
      "key": "M",
      "interface": "PCIe 4.0 x4",
      "_id": "67f9b7ce865ad0c3553db12d"
    },
    {
      "size": "2280",
      "key": "M",
      "interface": "PCIe 4.0 x4",
      "_id": "67f9b7ce865ad0c3553db12e"
    },
    {
      "size": "2280",
      "key": "M",
      "interface": "PCIe 4.0 x4",
      "_id": "67f9b7ce865ad0c3553db12f"
    },
    {
      "size": "2280",
      "key": "M",
      "interface": "PCIe 4.0 x4",
      "_id": "67f9b7ce865ad0c3553db130"
    },
    {
      "size": "2280",
      "key": "M",
      "interface": "PCIe 4.0 x4",
      "_id": "67f9b7ce865ad0c3553db131"
    }
  ],
  "onboard_ethernet": [
    {
      "speed": "5 Gb/s",
      "controller": "Realtek",
      "_id": "67f9b7ce865ad0c3553db132"
    }
  ],
  "ecc_support": false,
  "raid_support": true,
  "back_connect_connectors": false,
  "bios_features": {
    "flashback": false,
    "clear_cmos": false,
    "_id": "67f9b7ce865ad0c3553db133"
  },
  "back_panel_ports": [
    "1 x 5 Gb/s Ports (Realtek)"
  ],
  "general_product_information": {
    "amazon_sku": "B0DPLQXPG2"
  }
}