{
  "opendb_id": "ab7e6cc9-a827-4d81-9f04-1f7539a6fd3b",
  "memory": {
    "max": 64,
    "ram_type": "DDR4",
    "slots": 4
  },
  "storage_devices": {
    "sata_6_gb_s": 6,
    "sata_3_gb_s": 0,
    "u2": 0
  },
  "usb_headers": {
    "usb_2_0": 2,
    "usb_3_2_gen_1": 1,
    "usb_3_2_gen_2": 0,
    "usb_3_2_gen_2x2": 0,
    "usb_4": 0
  },
  "power_connectors": {
    "cpu_power": []
  },
  "audio": {
    "chipset": "Realtek",
    "channels": "7.1"
  },
  "metadata": {
    "name": "Asus Z370 ROG STRIX Z370-G GAMING (WI-FI AC) DDR4 Micro ATX",
    "manufacturer": "ASUS",
    "part_numbers": [
      "STRIX Z370-G GAMING (WI-FI AC)                                                    ROG STRIX Z370-G GAMING (WI-FI AC)"
    ],
    "series": "Z370",
    "variant": ""
  },
  "socket": "LGA1151",
  "form_factor": "Micro ATX",
  "chipset": "Intel Z370",
  "color": [
    "BLACK",
    "GREY"
  ],
  "pcie_slots": [
    {
      "gen": "4.0",
      "quantity": 2,
      "lanes": 16,
      "_id": "67f9b7e2865ad0c3553db38c"
    },
    {
      "gen": "4.0",
      "quantity": 2,
      "lanes": 1,
      "_id": "67f9b7e2865ad0c3553db38d"
    }
  ],
  "m2_slots": [
    {
      "size": "2242-2260",
      "key": "M",
      "interface": "PCIe 4.0 x4",
      "_id": "67f9b7e2865ad0c3553db38e"
    },
    {
      "size": "2280",
      "key": "M",
      "interface": "PCIe 4.0 x4",
      "_id": "67f9b7e2865ad0c3553db38f"
    },
    {
      "size": "2242-2260",
      "key": "M",
      "interface": "PCIe 4.0 x4",
      "_id": "67f9b7e2865ad0c3553db390"
    },
    {
      "size": "2280",
      "key": "M",
      "interface": "PCIe 4.0 x4",
      "_id": "67f9b7e2865ad0c3553db391"
    }
  ],
  "onboard_ethernet": [
    {
      "speed": "1 Gb/s",
      "controller": "Unknown",
      "_id": "67f9b7e2865ad0c3553db392"
    }
  ],
  "ecc_support": false,
  "raid_support": true,
  "back_connect_connectors": false,
  "bios_features": {
    "flashback": false,
    "clear_cmos": false,
    "_id": "67f9b7e2865ad0c3553db393"
  },
  "back_panel_ports": [
    "1 x 1 Gb/s"
  ],
  "general_product_information": {}
}