{
  "opendb_id": "d04f64f6-777e-4fd4-b3e0-4f425bc324e0",
  "memory": {
    "max": 256,
    "ram_type": "DDR5",
    "slots": 4
  },
  "storage_devices": {
    "sata_6_gb_s": 4,
    "sata_3_gb_s": 0,
    "u2": 0
  },
  "usb_headers": {
    "usb_2_0": 2,
    "usb_3_2_gen_1": 1,
    "usb_3_2_gen_2": 1,
    "usb_3_2_gen_2x2": 0,
    "usb_4": 0
  },
  "power_connectors": {
    "cpu_power": []
  },
  "audio": {
    "chipset": "Realtek",
    "channels": "7.1"
  },
  "metadata": {
    "name": "ASRock B860 Pro RS LGA1851 DDR5 ATX",
    "manufacturer": "ASRock",
    "part_numbers": [
      "B860 Pro RS                                                    90-MXBRM-A0UAYZ"
    ],
    "series": "B860",
    "variant": ""
  },
  "socket": "LGA1851",
  "form_factor": "ATX",
  "chipset": "Intel B860",
  "color": [
    "GREY",
    "BLACK"
  ],
  "pcie_slots": [
    {
      "gen": "4.0",
      "quantity": 2,
      "lanes": 16,
      "_id": "67f9bb83865ad0c3553e19bb"
    }
  ],
  "m2_slots": [
    {
      "size": "2280",
      "key": "M",
      "interface": "PCIe 4.0 x4",
      "_id": "67f9bb83865ad0c3553e19bc"
    },
    {
      "size": "2230-2242",
      "key": "M",
      "interface": "PCIe 4.0 x4",
      "_id": "67f9bb83865ad0c3553e19bd"
    },
    {
      "size": "2280",
      "key": "M",
      "interface": "PCIe 4.0 x4",
      "_id": "67f9bb83865ad0c3553e19be"
    },
    {
      "size": "2280",
      "key": "M",
      "interface": "PCIe 4.0 x4",
      "_id": "67f9bb83865ad0c3553e19bf"
    },
    {
      "size": "2280",
      "key": "E",
      "interface": "PCIe 4.0 x4",
      "_id": "67f9bb83865ad0c3553e19c0"
    }
  ],
  "onboard_ethernet": [
    {
      "speed": "2.5 Gb/s",
      "controller": "Realtek Dragon RTL8125BG",
      "_id": "67f9bb83865ad0c3553e19c1"
    }
  ],
  "ecc_support": false,
  "raid_support": true,
  "back_connect_connectors": false,
  "bios_features": {
    "flashback": false,
    "clear_cmos": false,
    "_id": "67f9bb83865ad0c3553e19c2"
  },
  "back_panel_ports": [
    "1 x 2.5 Gb/s (Realtek Dragon RTL8125BG)"
  ],
  "general_product_information": {
    "amazon_sku": "B0DSQX832M",
    "newegg_sku": "N82E16813162205"
  }
}