{
  "opendb_id": "cdf11c6a-aa25-4f46-9b4c-16c168a99042",
  "memory": {
    "max": 16,
    "ram_type": "DDR3",
    "slots": 2
  },
  "storage_devices": {
    "sata_6_gb_s": 0,
    "sata_3_gb_s": 4,
    "u2": 0
  },
  "usb_headers": {
    "usb_2_0": 3,
    "usb_3_2_gen_1": 0,
    "usb_3_2_gen_2": 0,
    "usb_3_2_gen_2x2": 0,
    "usb_4": 0
  },
  "power_connectors": {
    "cpu_power": []
  },
  "audio": {
    "chipset": "Realtek",
    "channels": "7.1"
  },
  "metadata": {
    "name": "Foxconn H61 H61AP LGA1155 DDR3 ATX",
    "manufacturer": "Foxconn",
    "part_numbers": [
      "H61AP"
    ],
    "series": "H61",
    "variant": ""
  },
  "socket": "LGA1155",
  "form_factor": "ATX",
  "chipset": "Intel H61",
  "color": [
    "BLUE",
    "WHITE"
  ],
  "pcie_slots": [
    {
      "gen": "4.0",
      "quantity": 1,
      "lanes": 16,
      "_id": "67f9b766865ad0c3553da64d"
    }
  ],
  "m2_slots": [],
  "onboard_ethernet": [
    {
      "speed": "1 Gb/s",
      "controller": "Unknown",
      "_id": "67f9b766865ad0c3553da64e"
    }
  ],
  "ecc_support": false,
  "raid_support": false,
  "back_connect_connectors": false,
  "bios_features": {
    "flashback": false,
    "clear_cmos": false,
    "_id": "67f9b766865ad0c3553da64f"
  },
  "back_panel_ports": [
    "1 x 1 Gb/s"
  ],
  "general_product_information": {}
}