{
  "opendb_id": "2662ee72-1b0f-46ec-a598-eef4cfc07244",
  "memory": {
    "max": 128,
    "ram_type": "DDR4",
    "slots": 4
  },
  "storage_devices": {
    "sata_6_gb_s": 0,
    "sata_3_gb_s": 0,
    "u2": 0
  },
  "usb_headers": {
    "usb_2_0": 2,
    "usb_3_2_gen_1": 2,
    "usb_3_2_gen_2": 1,
    "usb_3_2_gen_2x2": 0,
    "usb_4": 0
  },
  "power_connectors": {
    "cpu_power": []
  },
  "audio": {
    "chipset": "Realtek",
    "channels": "7.1"
  },
  "metadata": {
    "name": "Gigabyte X570 AORUS PRO WIFI AM4 DDR4 ATX",
    "manufacturer": "Gigabyte",
    "part_numbers": [
      "X570 AORUS PRO WIFI"
    ],
    "series": "X570",
    "variant": ""
  },
  "socket": "AM4",
  "form_factor": "ATX",
  "chipset": "AMD X570",
  "color": [
    "BLACK",
    "GREY"
  ],
  "pcie_slots": [
    {
      "gen": "4.0",
      "quantity": 3,
      "lanes": 16,
      "_id": "67f9b6f4865ad0c3553d99d9"
    },
    {
      "gen": "4.0",
      "quantity": 2,
      "lanes": 1,
      "_id": "67f9b6f4865ad0c3553d99da"
    }
  ],
  "m2_slots": [
    {
      "size": "2242-2260",
      "key": "M",
      "interface": "PCIe 4.0 x4",
      "_id": "67f9b6f4865ad0c3553d99db"
    },
    {
      "size": "2280",
      "key": "M",
      "interface": "PCIe 4.0 x4",
      "_id": "67f9b6f4865ad0c3553d99dc"
    },
    {
      "size": "2242-2260",
      "key": "M",
      "interface": "PCIe 4.0 x4",
      "_id": "67f9b6f4865ad0c3553d99dd"
    },
    {
      "size": "2280",
      "key": "M",
      "interface": "PCIe 4.0 x4",
      "_id": "67f9b6f4865ad0c3553d99de"
    }
  ],
  "onboard_ethernet": [
    {
      "speed": "1 Gb/s",
      "controller": "Unknown",
      "_id": "67f9b6f4865ad0c3553d99df"
    }
  ],
  "ecc_support": false,
  "raid_support": true,
  "back_connect_connectors": false,
  "bios_features": {
    "flashback": false,
    "clear_cmos": false,
    "_id": "67f9b6f4865ad0c3553d99e0"
  },
  "back_panel_ports": [
    "1 x 1 Gb/s Ports"
  ],
  "general_product_information": {
    "amazon_sku": "B07STNZF9L",
    "newegg_sku": "9SIBMM4K6E0640",
    "bestbuy_sku": 6371054
  }
}