{
  "opendb_id": "b047b75a-a0d1-4bd4-b45b-486c0a8d0847",
  "memory": {
    "max": 64,
    "ram_type": "DDR4",
    "slots": 4
  },
  "storage_devices": {
    "sata_6_gb_s": 6,
    "sata_3_gb_s": 0,
    "u2": 0
  },
  "usb_headers": {
    "usb_2_0": 4,
    "usb_3_2_gen_1": 4,
    "usb_3_2_gen_2": 2,
    "usb_3_2_gen_2x2": 0,
    "usb_4": 0
  },
  "power_connectors": {
    "cpu_power": []
  },
  "audio": {
    "chipset": "Realtek ALC892",
    "channels": "7.1"
  },
  "metadata": {
    "name": "MSI X470 GAMING PLUS",
    "manufacturer": "MSI",
    "part_number": "X470 GAMING PLUS",
    "series": "PERFORMANCE GAMING",
    "variant": null,
    "releaseYear": 2018,
    "part_numbers": []
  },
  "socket": "AM4",
  "form_factor": "ATX",
  "chipset": "AMD X470",
  "pcie_slots": [
    {
      "gen": "3.0",
      "quantity": 2,
      "lanes": 16,
      "_id": "67bbab1e656a333a9fdf6f19"
    },
    {
      "gen": "2.0",
      "quantity": 1,
      "lanes": 4,
      "_id": "67bbab1e656a333a9fdf6f1a"
    },
    {
      "gen": "2.0",
      "quantity": 3,
      "lanes": 1,
      "_id": "67bbab1e656a333a9fdf6f1b"
    }
  ],
  "m2_slots": [
    {
      "size": "2242/2260/2280/22110",
      "key": "M",
      "interface": "PCIe 3.0 x4",
      "_id": "67bbab1e656a333a9fdf6f1c"
    },
    {
      "size": "2242/2260/2280",
      "key": "M",
      "interface": "PCIe 2.0 x4",
      "_id": "67bbab1e656a333a9fdf6f1d"
    }
  ],
  "onboard_ethernet": [
    {
      "speed": "1 Gbps",
      "controller": "Realtek 8111H",
      "_id": "67bbab1e656a333a9fdf6f1e"
    }
  ],
  "ecc_support": false,
  "raid_support": true,
  "back_connect_connectors": false,
  "bios_features": {
    "flashback": false,
    "clear_cmos": true,
    "_id": "67bbab1e656a333a9fdf6f1f"
  },
  "back_panel_ports": [
    "PS/2",
    "DVI",
    "HDMI",
    "Ethernet (RJ-45)",
    "USB 2.0",
    "USB 3.1",
    "S/PDIF Out",
    "Audio Ports"
  ],
  "color": [],
  "general_product_information": {
    "amazon_sku": "B07CF31C1Q",
    "newegg_sku": "9SIBMM4K740594",
    "walmart_sku": 390785032
  }
}