{
  "opendb_id": "6b68296e-699c-4732-823e-5a1c75e1890b",
  "memory": {
    "max": 64,
    "ram_type": "DDR4",
    "slots": 4
  },
  "storage_devices": {
    "sata_6_gb_s": 6,
    "sata_3_gb_s": 0,
    "u2": 0
  },
  "usb_headers": {
    "usb_2_0": 2,
    "usb_3_2_gen_1": 2,
    "usb_3_2_gen_2": 0,
    "usb_3_2_gen_2x2": 0,
    "usb_4": 0
  },
  "power_connectors": {
    "cpu_power": []
  },
  "audio": {
    "chipset": "Realtek",
    "channels": "7.1"
  },
  "metadata": {
    "name": "Gigabyte Z270 GA-Z270-HD3 LGA1151 DDR4 ATX",
    "manufacturer": "Gigabyte",
    "part_numbers": [
      "GA-Z270-HD3"
    ],
    "series": "Z270",
    "variant": ""
  },
  "socket": "LGA1151",
  "form_factor": "ATX",
  "chipset": "Intel Z270",
  "color": [
    "BLACK",
    "GOLD"
  ],
  "pcie_slots": [
    {
      "gen": "4.0",
      "quantity": 3,
      "lanes": 16,
      "_id": "67f9b975865ad0c3553de04b"
    },
    {
      "gen": "4.0",
      "quantity": 2,
      "lanes": 1,
      "_id": "67f9b975865ad0c3553de04c"
    }
  ],
  "m2_slots": [
    {
      "size": "2242-2260",
      "key": "M",
      "interface": "PCIe 4.0 x4",
      "_id": "67f9b975865ad0c3553de04d"
    },
    {
      "size": "2280",
      "key": "M",
      "interface": "PCIe 4.0 x4",
      "_id": "67f9b975865ad0c3553de04e"
    }
  ],
  "onboard_ethernet": [
    {
      "speed": "1 Gb/s",
      "controller": "Unknown",
      "_id": "67f9b975865ad0c3553de04f"
    }
  ],
  "ecc_support": false,
  "raid_support": true,
  "back_connect_connectors": false,
  "bios_features": {
    "flashback": false,
    "clear_cmos": false,
    "_id": "67f9b975865ad0c3553de050"
  },
  "back_panel_ports": [
    "1 x 1 Gb/s"
  ],
  "general_product_information": {
    "amazon_sku": "B01NAK6CG2",
    "walmart_sku": 248597746
  }
}