{
  "opendb_id": "6f382bc8-7604-4e26-b372-fcd730d25e90",
  "memory": {
    "max": 128,
    "ram_type": "DDR4",
    "slots": 8
  },
  "storage_devices": {
    "sata_6_gb_s": 10,
    "sata_3_gb_s": 0,
    "u2": 0
  },
  "usb_headers": {
    "usb_2_0": 2,
    "usb_3_2_gen_1": 2,
    "usb_3_2_gen_2": 0,
    "usb_3_2_gen_2x2": 0,
    "usb_4": 0
  },
  "power_connectors": {
    "cpu_power": []
  },
  "audio": {
    "chipset": "Realtek",
    "channels": "7.1"
  },
  "metadata": {
    "name": "ASRock X99 Fatal1ty Professional/3.1 DDR4 EATX",
    "manufacturer": "ASRock",
    "part_numbers": [
      "Fatal1ty X99 Professional",
      "3.1"
    ],
    "series": "X99",
    "variant": ""
  },
  "socket": "LGA2011-3",
  "form_factor": "EATX",
  "chipset": "Intel X99",
  "color": [
    "BLACK",
    "RED"
  ],
  "pcie_slots": [
    {
      "gen": "4.0",
      "quantity": 5,
      "lanes": 16,
      "_id": "67f9b7a5865ad0c3553dad1b"
    }
  ],
  "m2_slots": [
    {
      "size": "2230-2242",
      "key": "M",
      "interface": "PCIe 4.0 x4",
      "_id": "67f9b7a5865ad0c3553dad1c"
    },
    {
      "size": "2280",
      "key": "M",
      "interface": "PCIe 4.0 x4",
      "_id": "67f9b7a5865ad0c3553dad1d"
    },
    {
      "size": "2242-2260",
      "key": "M",
      "interface": "PCIe 4.0 x4",
      "_id": "67f9b7a5865ad0c3553dad1e"
    },
    {
      "size": "2280",
      "key": "M",
      "interface": "PCIe 4.0 x4",
      "_id": "67f9b7a5865ad0c3553dad1f"
    }
  ],
  "onboard_ethernet": [
    {
      "speed": "1 Gb/s",
      "controller": "Intel I218-V",
      "_id": "67f9b7a5865ad0c3553dad20"
    }
  ],
  "ecc_support": false,
  "raid_support": true,
  "back_connect_connectors": false,
  "bios_features": {
    "flashback": false,
    "clear_cmos": false,
    "_id": "67f9b7a5865ad0c3553dad21"
  },
  "back_panel_ports": [
    "1 x 1 Gb/s (Intel I218-V)                                                    1 x 1 Gb/s (Intel Killer E2200)"
  ],
  "general_product_information": {}
}