{
  "opendb_id": "11b3c400-baf9-404f-b917-04425e782daf",
  "memory": {
    "max": 64,
    "ram_type": "DDR4",
    "slots": 2
  },
  "storage_devices": {
    "sata_6_gb_s": 4,
    "sata_3_gb_s": 0,
    "u2": 0
  },
  "usb_headers": {
    "usb_2_0": 2,
    "usb_3_2_gen_1": 1,
    "usb_3_2_gen_2": 0,
    "usb_3_2_gen_2x2": 0,
    "usb_4": 0
  },
  "power_connectors": {
    "cpu_power": []
  },
  "audio": {
    "chipset": "Realtek",
    "channels": "7.1"
  },
  "metadata": {
    "name": "MSI B550 M PRO DDR4 Micro ATX",
    "manufacturer": "MSI",
    "part_numbers": [
      "B550M PRO"
    ],
    "series": "B550",
    "variant": ""
  },
  "socket": "AM4",
  "form_factor": "Micro ATX",
  "chipset": "AMD B550",
  "color": [
    "BLACK"
  ],
  "pcie_slots": [
    {
      "gen": "4.0",
      "quantity": 1,
      "lanes": 16,
      "_id": "67f9b92d865ad0c3553dd89d"
    },
    {
      "gen": "4.0",
      "quantity": 2,
      "lanes": 1,
      "_id": "67f9b92d865ad0c3553dd89e"
    }
  ],
  "m2_slots": [
    {
      "size": "2242-2260",
      "key": "M",
      "interface": "PCIe 4.0 x4",
      "_id": "67f9b92d865ad0c3553dd89f"
    },
    {
      "size": "2280",
      "key": "M",
      "interface": "PCIe 4.0 x4",
      "_id": "67f9b92d865ad0c3553dd8a0"
    }
  ],
  "onboard_ethernet": [
    {
      "speed": "1 Gb/s",
      "controller": "Realtek 8111H",
      "_id": "67f9b92d865ad0c3553dd8a1"
    }
  ],
  "ecc_support": false,
  "raid_support": true,
  "back_connect_connectors": false,
  "bios_features": {
    "flashback": false,
    "clear_cmos": false,
    "_id": "67f9b92d865ad0c3553dd8a2"
  },
  "back_panel_ports": [
    "1 x 1 Gb/s (Realtek 8111H)"
  ],
  "general_product_information": {}
}