{
  "opendb_id": "ba3003c6-fa40-48e6-935c-4a3d1eccdd93",
  "memory": {
    "max": 4,
    "ram_type": "DDR2",
    "slots": 2
  },
  "storage_devices": {
    "sata_6_gb_s": 0,
    "sata_3_gb_s": 4,
    "u2": 0
  },
  "usb_headers": {
    "usb_2_0": 3,
    "usb_3_2_gen_1": 0,
    "usb_3_2_gen_2": 0,
    "usb_3_2_gen_2x2": 0,
    "usb_4": 0
  },
  "power_connectors": {
    "cpu_power": []
  },
  "audio": {
    "chipset": "Realtek",
    "channels": "7.1"
  },
  "metadata": {
    "name": "Zotac NVIDIA nForce 430 MCP GF6100-E-E AM3/AM2+ DDR2 Mini ITX",
    "manufacturer": "Zotac",
    "part_numbers": [
      "GF6100-E-E"
    ],
    "series": "NVIDIA",
    "variant": ""
  },
  "socket": "AM3",
  "form_factor": "Mini-ITX",
  "chipset": "NVIDIA nForce 430 MCP",
  "color": [
    "BLUE",
    "RED"
  ],
  "pcie_slots": [
    {
      "gen": "4.0",
      "quantity": 1,
      "lanes": 1,
      "_id": "67f9b7af865ad0c3553dadc9"
    }
  ],
  "m2_slots": [],
  "onboard_ethernet": [
    {
      "speed": "1 Gb/s",
      "controller": "Unknown",
      "_id": "67f9b7af865ad0c3553dadca"
    }
  ],
  "ecc_support": false,
  "raid_support": true,
  "back_connect_connectors": false,
  "bios_features": {
    "flashback": false,
    "clear_cmos": false,
    "_id": "67f9b7af865ad0c3553dadcb"
  },
  "back_panel_ports": [
    "1 x 1 Gb/s"
  ],
  "general_product_information": {}
}