{
  "opendb_id": "e93007a9-8364-4b25-95d1-7846e923580b",
  "memory": {
    "max": 256,
    "ram_type": "DDR5",
    "slots": 4
  },
  "storage_devices": {
    "sata_6_gb_s": 0,
    "sata_3_gb_s": 0,
    "u2": 0
  },
  "usb_headers": {
    "usb_2_0": 2,
    "usb_3_2_gen_1": 1,
    "usb_3_2_gen_2": 1,
    "usb_3_2_gen_2x2": 0,
    "usb_4": 0
  },
  "power_connectors": {
    "cpu_power": []
  },
  "audio": {
    "chipset": "Realtek",
    "channels": "7.1"
  },
  "metadata": {
    "name": "Gigabyte B850M D3HP AM5 DDR5 Micro ATX",
    "manufacturer": "Gigabyte",
    "part_numbers": [
      "B850M D3HP"
    ],
    "series": "B850M",
    "variant": ""
  },
  "socket": "AM5",
  "form_factor": "Micro ATX",
  "chipset": "AMD B850",
  "color": [
    "GREY",
    "BLACK"
  ],
  "pcie_slots": [
    {
      "gen": "4.0",
      "quantity": 2,
      "lanes": 16,
      "_id": "67f9b9db865ad0c3553debc1"
    }
  ],
  "m2_slots": [
    {
      "size": "2280",
      "key": "M",
      "interface": "PCIe 4.0 x4",
      "_id": "67f9b9db865ad0c3553debc2"
    },
    {
      "size": "2280-22110",
      "key": "M",
      "interface": "PCIe 4.0 x4",
      "_id": "67f9b9db865ad0c3553debc3"
    },
    {
      "size": "2280",
      "key": "M",
      "interface": "PCIe 4.0 x4",
      "_id": "67f9b9db865ad0c3553debc4"
    }
  ],
  "onboard_ethernet": [
    {
      "speed": "1 Gb/s",
      "controller": "Realtek",
      "_id": "67f9b9db865ad0c3553debc5"
    }
  ],
  "ecc_support": false,
  "raid_support": true,
  "back_connect_connectors": false,
  "bios_features": {
    "flashback": false,
    "clear_cmos": false,
    "_id": "67f9b9db865ad0c3553debc6"
  },
  "back_panel_ports": [
    "1 x 1 Gb/s Ports (Realtek)"
  ],
  "general_product_information": {
    "amazon_sku": "B0DQNQM897"
  }
}