{
  "opendb_id": "0bc0977d-38f3-4a4b-a7b8-edfc35c6c967",
  "memory": {
    "max": 192,
    "ram_type": "DDR5",
    "slots": 4
  },
  "storage_devices": {
    "sata_6_gb_s": 0,
    "sata_3_gb_s": 0,
    "u2": 0
  },
  "usb_headers": {
    "usb_2_0": 2,
    "usb_3_2_gen_1": 2,
    "usb_3_2_gen_2": 1,
    "usb_3_2_gen_2x2": 0,
    "usb_4": 0
  },
  "power_connectors": {
    "cpu_power": []
  },
  "audio": {
    "chipset": "Realtek",
    "channels": "7.1"
  },
  "metadata": {
    "name": "Asus B650 PRIME B650M-A AX6 II AM5 DDR5 Micro ATX",
    "manufacturer": "ASUS",
    "part_numbers": [
      "PRIME B650M-A AX6 II"
    ],
    "series": "B650",
    "variant": ""
  },
  "socket": "AM5",
  "form_factor": "Micro ATX",
  "chipset": "AMD B650",
  "color": [
    "GREY",
    "BLACK"
  ],
  "pcie_slots": [
    {
      "gen": "4.0",
      "quantity": 4,
      "lanes": 16,
      "_id": "67f9baf2865ad0c3553e0a21"
    }
  ],
  "m2_slots": [
    {
      "size": "2242-2260",
      "key": "M",
      "interface": "PCIe 4.0 x4",
      "_id": "67f9baf2865ad0c3553e0a22"
    },
    {
      "size": "2280",
      "key": "M",
      "interface": "PCIe 4.0 x4",
      "_id": "67f9baf2865ad0c3553e0a23"
    },
    {
      "size": "2242-2260",
      "key": "M",
      "interface": "PCIe 4.0 x4",
      "_id": "67f9baf2865ad0c3553e0a24"
    },
    {
      "size": "2280",
      "key": "M",
      "interface": "PCIe 4.0 x4",
      "_id": "67f9baf2865ad0c3553e0a25"
    },
    {
      "size": "2242-2260",
      "key": "M",
      "interface": "PCIe 4.0 x4",
      "_id": "67f9baf2865ad0c3553e0a26"
    },
    {
      "size": "2280",
      "key": "M",
      "interface": "PCIe 4.0 x4",
      "_id": "67f9baf2865ad0c3553e0a27"
    }
  ],
  "onboard_ethernet": [
    {
      "speed": "1 Gb/s",
      "controller": "Realtek",
      "_id": "67f9baf2865ad0c3553e0a28"
    }
  ],
  "ecc_support": false,
  "raid_support": true,
  "back_connect_connectors": false,
  "bios_features": {
    "flashback": false,
    "clear_cmos": false,
    "_id": "67f9baf2865ad0c3553e0a29"
  },
  "back_panel_ports": [
    "1 x 1 Gb/s Ports (Realtek)"
  ],
  "general_product_information": {}
}