{
  "opendb_id": "d4adb577-2419-4c31-bc6c-0a55a0cbc6be",
  "memory": {
    "max": 32,
    "ram_type": "DDR4",
    "slots": 2
  },
  "storage_devices": {
    "sata_6_gb_s": 6,
    "sata_3_gb_s": 0,
    "u2": 0
  },
  "usb_headers": {
    "usb_2_0": 2,
    "usb_3_2_gen_1": 1,
    "usb_3_2_gen_2": 0,
    "usb_3_2_gen_2x2": 0,
    "usb_4": 0
  },
  "power_connectors": {
    "cpu_power": []
  },
  "audio": {
    "chipset": "Realtek",
    "channels": "7.1"
  },
  "metadata": {
    "name": "MSI B360M PRO-VH DDR4 Micro ATX",
    "manufacturer": "MSI",
    "part_numbers": [
      "B360M PRO-VH                                                                                                        911-7B53-001"
    ],
    "series": "B360M",
    "variant": ""
  },
  "socket": "LGA1151",
  "form_factor": "Micro ATX",
  "chipset": "Intel B360",
  "color": [
    "BROWN",
    "BLACK"
  ],
  "pcie_slots": [
    {
      "gen": "4.0",
      "quantity": 1,
      "lanes": 16,
      "_id": "67f9b81e865ad0c3553dba4e"
    },
    {
      "gen": "4.0",
      "quantity": 2,
      "lanes": 1,
      "_id": "67f9b81e865ad0c3553dba4f"
    }
  ],
  "m2_slots": [
    {
      "size": "2242-2260",
      "key": "M",
      "interface": "PCIe 4.0 x4",
      "_id": "67f9b81e865ad0c3553dba50"
    },
    {
      "size": "2280",
      "key": "M",
      "interface": "PCIe 4.0 x4",
      "_id": "67f9b81e865ad0c3553dba51"
    }
  ],
  "onboard_ethernet": [
    {
      "speed": "1 Gb/s",
      "controller": "Unknown",
      "_id": "67f9b81e865ad0c3553dba52"
    }
  ],
  "ecc_support": false,
  "raid_support": false,
  "back_connect_connectors": false,
  "bios_features": {
    "flashback": false,
    "clear_cmos": false,
    "_id": "67f9b81e865ad0c3553dba53"
  },
  "back_panel_ports": [
    "1 x 1 Gb/s"
  ],
  "general_product_information": {}
}