{
  "opendb_id": "10adb98b-57a4-4311-a4ea-11003920749f",
  "memory": {
    "max": 64,
    "ram_type": "DDR3",
    "slots": 8
  },
  "storage_devices": {
    "sata_6_gb_s": 2,
    "sata_3_gb_s": 4,
    "u2": 0
  },
  "usb_headers": {
    "usb_2_0": 2,
    "usb_3_2_gen_1": 0,
    "usb_3_2_gen_2": 0,
    "usb_3_2_gen_2x2": 0,
    "usb_4": 0
  },
  "power_connectors": {
    "cpu_power": []
  },
  "audio": {
    "chipset": "Realtek",
    "channels": "7.1"
  },
  "metadata": {
    "name": "Supermicro Intel C606 X9DRL-3F Dual-CPU LGA2011 DDR3 ATX",
    "manufacturer": "Supermicro",
    "part_numbers": [
      "X9DRL-3F                                                    X9DRL-3F-O"
    ],
    "series": "Intel",
    "variant": ""
  },
  "socket": "2 x LGA2011",
  "form_factor": "ATX",
  "chipset": "Intel C606",
  "color": [
    "GREEN",
    "BLUE"
  ],
  "pcie_slots": [
    {
      "gen": "4.0",
      "quantity": 4,
      "lanes": 8,
      "_id": "67f9ba6f865ad0c3553dfbee"
    },
    {
      "gen": "4.0",
      "quantity": 1,
      "lanes": 1,
      "_id": "67f9ba6f865ad0c3553dfbef"
    }
  ],
  "m2_slots": [],
  "onboard_ethernet": [
    {
      "speed": "1 Gb/s",
      "controller": "Unknown",
      "_id": "67f9ba6f865ad0c3553dfbf0"
    }
  ],
  "ecc_support": true,
  "raid_support": true,
  "back_connect_connectors": false,
  "bios_features": {
    "flashback": false,
    "clear_cmos": false,
    "_id": "67f9ba6f865ad0c3553dfbf1"
  },
  "back_panel_ports": [
    "2 x 1 Gb/s"
  ],
  "general_product_information": {}
}